{
  "schema_version": 2,
  "fixture_id": "checkpoint-continuation-v2",
  "fixture_version": 2,
  "scenario_kind": "checkpoint_continuation",
  "prompt": "payload/prompt.md",
  "acceptance_criteria": "payload/acceptance.md",
  "seed_repository": "payload/seed",
  "initial_repository": {
    "default_branch": "main",
    "initial_ref": "fixture-v2",
    "clean_worktree": true
  },
  "grader": {
    "id": "checkpoint-continuation-grader",
    "version": 2,
    "digest": "sha256:c7f5c933ef99eede08ae97d7fba123dd1169c3708e4333dcc55cbb86ee5fe28f"
  }
}
